{
  "program": "cat",
  "version": {
    "range": "*",
    "args": [],
    "pattern": ""
  },
  "okCodes": [
    0
  ],
  "echoes": false,
  "command": {
    "effects": [
      "read"
    ],
    "paths": "operands",
    "noPaths": "nothing",
    "terminator": "--",
    "clusters": true,
    "flags": {
      "-b": {},
      "-e": {},
      "-n": {},
      "-s": {},
      "-t": {},
      "-u": {},
      "-v": {}
    }
  }
}
